{
  "detection": {
    "adapter": "navori-master",
    "artifacts": [
      {
        "name": "MASTER.md",
        "path": "specs/_master/01-mvp/MASTER.md",
        "present": true,
        "sha256": "67aadc16abd8679f6fdd826ae01f137f5f6afb2107a263433c7dd6776d7d7b9e"
      },
      {
        "name": "DECISIONS.md",
        "path": "specs/_master/01-mvp/DECISIONS.md",
        "present": true,
        "sha256": "57c17b0dc1509fb598b1d8b607ce4280cb96f7342480f5e586c34cc63a8a685a"
      },
      {
        "name": "parts.json",
        "path": "specs/_master/01-mvp/parts.json",
        "present": true,
        "sha256": "d993bade9cbc5bc46748369e35bc08d04e217142f3cfa3441500362d56c972c0"
      },
      {
        "name": "UX.md",
        "path": "specs/_master/01-mvp/UX.md",
        "present": false,
        "sha256": null
      },
      {
        "name": "ux.json",
        "path": "specs/_master/01-mvp/ux.json",
        "present": false,
        "sha256": null
      },
      {
        "name": "DIGEST.md",
        "path": "specs/_master/01-mvp/context/DIGEST.md",
        "present": true,
        "sha256": "3f789c108e634990352e98e5bbac5ee2cccf36785d0e0352c84f37d554e8e2fa"
      },
      {
        "name": "CODEBASE.md",
        "path": "specs/_master/01-mvp/context/CODEBASE.md",
        "present": true,
        "sha256": "594ecd5080c6737c18cb86dc36ab6e8cff8f9eef70a1a5e2b6b31ca52ef512bd"
      }
    ],
    "findings": [],
    "harness": {
      "mode": "template",
      "phase": "executing",
      "ux": null
    },
    "navoriMaster": true,
    "specsDir": "specs",
    "stage": {
      "dir": "01-mvp",
      "number": 1,
      "selection": "active",
      "slug": "mvp",
      "state": "activa"
    },
    "stageNotice": null,
    "stageStatus": "selected",
    "uxJson": {
      "issues": [],
      "path": "specs/_master/01-mvp/ux.json",
      "present": false,
      "reader": "provisional-1",
      "sha256": null,
      "summary": null,
      "valid": null
    },
    "uxMarkdown": {
      "issues": [],
      "path": "specs/_master/01-mvp/UX.md",
      "present": false,
      "sha256": null,
      "valid": null
    }
  },
  "findings": [],
  "kind": "ModeDecision",
  "mode": "reference-only",
  "reasons": [
    {
      "code": "UX_FILES_MISSING",
      "message": "UX.md and ux.json are both missing."
    }
  ],
  "schemaVersion": 1
}
